"firm";"phone";"email";"title";"text";"domain"
"ЖК Новый Зеленоград";"+7 (495) 104-57-47";"sale@newzelenograd.ru";"Все застройщики Москвы и области / novostroy-m.ru";"Проверенные новостройки. Прямые продажи от 1,7 млн. Аэросъемка и видео-обзоры.Проектная декларация на рекламируемом сайте";"https://novostroy-m.ru"
"ЖК Новый Зеленоград";"+7 (495) 104-57-47";"sale@newzelenograd.ru";"От 2,1 млн руб без 1-го взноса – ЖК Новый Зеленоград";"Квартиры с ключами в день сделки. Ипотека от 14 000 руб./мес. Выгода 250 000 руб.!";"https://newzelenograd.ru"
"";"";"";"Квартиры от застройщика  – В Москве и области";"Новостройки от 2,1 млн руб. С отделкой и без. Развитая инфраструктура. Звоните!";"https://pik.ru"
"";"";"";"ЖК от застройщиков в Москве! – Выгодно. Удобно. Все здесь!";"Ищете квартиру в новостройке? Спецпредложения от застройщиков, рассрочка 0%Проектная декларация на рекламируемом сайте";"https://avaho.ru"
"";"";"";"Квартиры в Москве от 2 млн.руб. - Готовые новостройки!";"250 метров от метро! Льготные цены! ФЗ-214 Звоните!";"https://mosdom.su"
"";"";"";"Все застройщики Москвы и МО – Квартиры в новостройках";"Лучшие предложения от застройщиков на этой неделе на портале move.ruПроектная декларация на рекламируемом сайте";"https://move.ru"
"";"";"";"Квартиры от застройщика от 3,2 млн – Ипотека от 6%";"Рассрочка 0%. Новостройки в Новой Москве. Выдача ключей с 2019. Рядом с метро!";"https://a101.ru"
"";"";"";"Квартиры от застройщика от 1,3 млн р! - 5 минут до метро!";"Рассрочка 0%! 214-ФЗ! Скидки и акции! Продуманная инфраструктура!Проектная декларация на рекламируемом сайте";"https://msk.vnovoselie.ru"
"";"";"";"Готовые таунхаусы в Новой Москве! – За 5,71 млн. руб.";"Таунхаусы от 145 до 185 м2. Киевское шоссе. Рассрочка от застройщика. 22 км от МКАД.";"https://townhouse.ru"
"";"";"";"Квартиры от Хозяев и Застройщиков – Цены рухнули";"Единая база квартир. Купить квартиры в Москве и Подмосковье. Скидки и акцииПроектная декларация на рекламируемом сайте";"https://kvadroom.ru"
"АО ""Сити-XXI век""";"+7 (495) 241-57-14";"post@city-xxi.ru";"""Сити-XXI век"" заготовили на осень / kraski-zhizni-vidnoe.ru";"Купите квартиру в Видном со скидкой до 25% и переезжайте! Встречайте осень уютно!";"https://kraski-zhizni-vidnoe.ru"
"ООО ""Кристалл""";"+7 (800) 100-00-26";"manager@anapameteora.ru";"Каталог застройщиков Москва / poisk-novostroyki.ru";"Строительные компании Москвы и их новостройки. Акции и скидки на квартиры.Проектная декларация на рекламируемом сайте";"https://poisk-novostroyki.ru"
"ООО ""Кристалл""";"+7 (800) 100-00-26";"manager@anapameteora.ru";"Комплект заземления «ЭКСТРА-6Н» / elmast.com";"7 900 рублей за комплект заземления из нержавеющей стали. Склад в Москве.";"https://elmast.com"
"ООО ""Кристалл""";"+7 (800) 100-00-26";"manager@anapameteora.ru";"Квартиры от застройщика – Анапа! / anapameteora.ru";"ЖК Метеора - комфорт без %. Цены и планировки на сайте! 214-ФЗ. Звоните!";"https://anapameteora.ru"
"";"";"";"Стройкасса. Жилье молодой семье. / стройкасса.рф";"Квартира в рассрочку, без ипотеки и кредита.";"https://стройкасса.рф"
"";"";"";"Инициативным группам дольщиков! / nekrasoff.ru";"Правовой центр Олега Некрасова: реальная помощь пострадавшим дольщикам";"https://nekrasoff.ru"
"";"";"";"Квартиры от ГСК «Красстрой» / красстрой.рф";"Начните выбор с надежной компании! Удобный поиск. Красноярск. Квартиры от 1 млн.руб.";"https://красстрой.рф"
"";"";"";"Юридическая консультация в Москве / pravozona.ru";"Готовы помочь Вам решить Ваши проблемы. Консультация бесплатно. Звоните или пишите";"https://pravozona.ru"
"";"";"";"жк ""Кленовые Аллеи"", Новая Москва / vk.com";"Распродажа на выделенный объём квартир, метро ""Ватутинки"" через дорогу";"https://vk.com"
"";"";"";"По чем от застройщика в МСК и МО / move.su";"Продажа квартир в Москве и МО. Актуальные предложения от застройщиков!";"https://move.su"
"";"";"";"По чем от застройщика в МСК и МО / move.su";"Продажа квартир в Москве и МО. Актуальные предложения от застройщиков!";"https://move.su"
"";"";"";"ЖК ""Лучи"" ЛСР в Солнцево / luchi-lsr.site";"ЖК ""Лучи"" ЛСР в Солнцево. Квартиры с отделкой от 4.75 млн р. Открытие метро в сентябре.";"https://luchi-lsr.site"
"";"";"";"Список строительных компаний и застройщиков Москвы";"Все новостройки Москвы – планировки и цены на квартиры от застройщика!Проектная декларация на рекламируемом сайте";"https://msk-novostroyki.ru"
"";"";"";"Бальные танцы для детей в ЮАО / leninskij.dance-dynamo.ru";"Хочешь записаться на бальные танцы в ЮАО? Новый набор уже идет. Мы ждем тебя!";"https://leninskij.dance-dynamo.ru"
"";"";"";"Участки в Московской области! / kp-podol.ru";"Земельные участки с подрядом на строительство дома! Живописный район Подмосковья!";"https://kp-podol.ru"
"";"";"";"Комната на маткапитал / center-fp.ru";"Поможем купить комнату на материнский капитал!Нам доверяют более 6000 семей";"https://center-fp.ru"
"";"";"";"Гостиница ""Москва""  – Краснодарский край";"Путевки в Гостиницу ""Москва"" Краснодар от КУРОРТНОГО МАГАЗИНА";"https://kurortmag.ru"
"";"";"";"Студии, квартиры в Севастополе / crymchanka.ru";"Без агентской комиссии, процентов, переплат. С балконом и видом на море!Проектная декларация на рекламируемом сайте";"https://crymchanka.ru"
"";"";"";"ЖК ""Москвичка"", 5км от МКАД – Квартиры от 2.675.100 ₽";"ЖК ""Москвичка"", квартиры от 2.675.100 ₽ в 5км от МКАД.";"https://moskvichka.site"
"";"";"";"Как увеличить рост ребенку? - Методика роста Клонэри.";"Стать выше ростом. Спрашивай в аптеках города!Не является лекарством";"https://clonery.ru"
"Квартирник78";"+7 (812) 785-08-36";"iulya.super2018@yandex.ru";"Помощь с дипломными работами / dipmasters.ru";"ДипМастер – помощь в выполнении дипломных и курсовых работ для студентов";"https://dipmasters.ru"
"Квартирник78";"+7 (812) 785-08-36";"iulya.super2018@yandex.ru";"Квартиры в Московской области! / domex.ru";"Недвижимость в Московской области. Широчайший выбор по доступным ценам!Проектная декларация на рекламируемом сайте";"https://domex.ru"
"Квартирник78";"+7 (812) 785-08-36";"iulya.super2018@yandex.ru";"Поставки уличной мебели / 5805845.ru";"26 дистрибьюторских центров в России и СНГ. Огромный ассортимент.";"https://5805845.ru"
"Квартирник78";"+7 (812) 785-08-36";"iulya.super2018@yandex.ru";"Москва в социальной сети / owohho.com";"Социальная сеть для знакомства с Москвичами и всем миром.";"https://owohho.com"
"Квартирник78";"+7 (812) 785-08-36";"iulya.super2018@yandex.ru";"застройщики.рф - домен продается / застройщики.рф";"застройщики.рф - купить или арендовать доменное имя на SITE.SU";"https://застройщики.рф"
"Квартирник78";"+7 (812) 785-08-36";"iulya.super2018@yandex.ru";"Мы – экономисты. Выполняем на заказ. / дм-консалтинг.рф";"Разработки, проекты, аналитика, расчеты, документация, исследования, ТЭО, многое другое";"https://дм-консалтинг.рф"
"Квартирник78";"+7 (812) 785-08-36";"iulya.super2018@yandex.ru";"Устали искать какую квартиру купить / kvartirnik78.ru";"Устали искать какую квартиру купить в Санкт-Петербурге?Идеальный вариант за 20 м";"https://kvartirnik78.ru"
"";"";"";"Инструкции к любым торговым и / mosoblvending.ru";"Библиотека технических знаний по популярному и редкому вендинговому оборудованию.";"https://mosoblvending.ru"
"";"";"";"Устали от лжи и лицемерия СМИ? / stmedia24.ru";"Читай, общайся и оставляй своё мнение по самым актуальным темам на СТМ / 24";"https://stmedia24.ru"
"";"";"";"области.рф - домен продается / области.рф";"области.рф - купить или арендовать доменное имя на SITE.SU";"https://области.рф"
"";"";"";"Новостройка от застройщика в МО – Всего от 1,65 млн руб!";"Квартиры от застройщика. По стартовой цене. Получите приглашение на открытие продаж";"https://novostroyka-na-starte.ru"
"Жилой квартал ""Зеленые аллеи"" от ГК ""МИЦ""";"+7 (495) 320-94-45";"MIC-ODP@GK-MIC.RU";"Новостройки в Подмосковье – Цены от 2,8 млн!";"ЖК «Зеленые аллеи». Комфорт класс. Скидки 4%. Ипотека 6%. МКАД - 4 км. Звоните!";"https://special.domvvidnom.ru"
"ЖК Новый Зеленоград";"+7 (495) 104-57-47";"sale@newzelenograd.ru";"Квартиры с отделкой – От 2,3 млн руб без 1-го взноса";"ЖК Новый Зеленоград. Квартиры с отделкой от 2,3 млн руб. Ипотека от 16 000 руб./мес.";"https://newzelenograd.ru"
"ФСК Лидер";"+7 (495) 125-05-00";"info@anlider.info";"Новостройка от застройщика: отделка - Авторские планировки.";"Квартиры с отделкой от 3,4 млн. руб. 15 мин. от метро. Звоните!";"https://uprimskiy.ru"
"ФСК ""Лидер""";"+7 (495) 256-31-67";"info@anlider.info";"Новостройка от застройщика: отделка / skolkovskiy.ru";"Квартиры с отделкой от 3,6 млн руб. Всего 4 км от МКАД. Престижный район. Звоните!";"https://skolkovskiy.ru"
"";"";"";"Квартиры с отделкой от 1,5 млн ₽ – Новостройка";"2 варианта отделки. Все квартиры с балконом. Ключи в 2019 г. 30 минут до Москвы!";"https://lukinovarino.ru"
"";"";"";"Новостройки в Подмосковье - ЖК «Опалиха Парк».";"Квартиры от застройщика от 1 725 000 руб. 15 мин. до м. Тушинская!";"https://k-np.ru"
"ООО СИК ""Девелопмент-ЮГ""";"+7 (800) 100-07-75";"zhcrivjera-development@yandex.ru";"Новостройки с отделкой от - застройщика.";"от 64 000 за кв.м. Парк «Чистяковская Роща». Центр города.";"https://краснодар.жилой-комплекс-ривьера.рф"
"";"";"";"Квартиры рядом с Иваньковским вдхр. – ЖК ""Завидово""";"Квартиры 37-90 м2 от 2.4 млн.₽ с отделкой! Дом сдан! Рядом Иваньковское вдхр. и р.Волга!";"https://flat.zavidovo.com"
"Офис продаж микрорайона ""Новый Клин""";"8 (800) 333-37-90";"info@novklin.ru";"Квартиры с отделкой от застройщика – В ЖК «Новый Клин»!";"Новостройки 2019 всего от 1,1 млн. Бронируй до повышения цен 15 сентября!";"https://новыйклин.рф"
"Лидер на Дмитровском";"+7 (495) 154-80-67";"info@l-invest.ru";"Новостройка «Лидер на Дмитровском» – Квартиры от 6,2 млн";"ЖК комфорт-класса. Первый взнос 0%. Свободные планировки. Готовность в 2019 г.";"https://lidernadmitrovskom.ru"
"";"";"";"ЖК с отделкой от застройщика – Сдача дома в 2018 году!";"ЖК «Олимп»: квартиры от 1,5 млн ₽! Городской комфорт и красота природы.";"https://dom-olymp.ru"
"";"";"";"Квартиры в новостройках от INGRAD – Официальный сайт";"18 объектов в Москве и Подмосковье. Квартиры от 1,9 млн рублей. С отделкой и без.";"https://ingrad.ru"
"";"";"";"Новостройки Подмосковья! Все цены! / avaho.ru";"Ищете квартиру в новостройке? Спецпредложения от застройщиков, рассрочка 0%Проектная декларация на рекламируемом сайте";"https://avaho.ru"
"";"";"";"Квартиры от Группы ПИК – Люблинский парк";"Старт продаж. С отделкой от 3,1 млн руб. 15 минут пешком до м. Братиславская. Звоните!";"https://pik.ru"
"";"";"";"Новостройки в Подмосковье дешево / metrinfo.ru";"Квартиры и новостройки в Подмосковье. Только проверенные объекты! Звоните!Проектная декларация на рекламируемом сайте";"https://metrinfo.ru"
"";"";"";"Квартиры в готовой новостройке – Дом сдан.";"1 м.2 — от 54 640 ₽. Экологически чистый р-н. ЖК «Первый Зеленоградский». Звоните!";"https://zlgrad.ru"
"";"";"";"Вспомните о ЖК «Две Столицы» - Прописка и собственность.";"Ключи в день сделки. Сопровождение ипотеки. Звоните!";"https://2столицы.рф"
"";"";"";"Новостройки с отделкой от 3,2 млн – Ипотека от 6%";"м.Теплый Стан - 10 минут. Квартиры с отделкой и без в Новой Москве. Рядом лес и парк!";"https://a101.ru"
"";"";"";"Квартиры с отделкой. Новостройки / move.ru";"Квартиры с отделкой в новостройках от 1,9 млн. руб.! Чистовая отделка!Проектная декларация на рекламируемом сайте";"https://move.ru"
"";"";"";"Квартиры с отделкой. Новостройки / move.ru";"Квартиры с отделкой в новостройках от 1,9 млн. руб.! Чистовая отделка!Проектная декларация на рекламируемом сайте";"https://move.ru"
"";"";"";"Новостройки от 1,2 млн. р! Рассрочка! / msk.vnovoselie.ru";"Квартиры в черте города! Удобные планировки! Закрытые дворы! Детсады и школы! 214-ФЗ!Проектная декларация на рекламируемом сайте";"https://msk.vnovoselie.ru"
"";"";"";"Новостройки от застройщика - Обвал цен до 35%!";"Прямые телефоны застройщиков Подмосковья. Без доплат!";"https://kvartirazamkad.ru"
"";"";"";"Новостройки и ЖК в Москве – Акции на сайте";"Новостройки в Подмосковье с отделкой";"https://kvadroom.ru"
"";"";"";"Ищете ЖК Трубецкое? ЖК Эдельвейс! - Акция на квартиры!";"Торопитесь предложение ограничено!";"https://эдельвейс-комфорт.рф"
"";"";"";"Все новостройки на одном сайте / realtystreet.ru";"Варианты планировок, инфраструктура. Цены. Спецпредложения. Скидки.Проектная декларация на рекламируемом сайте";"https://realtystreet.ru"
"";"";"";"Новые квартиры в Подмосковье! - г. Ступино.";"Квартиры от 2 000 000 от застройщика. Подробнее на сайте!";"https://b-stupino.ru"
"";"";"";"новостройки в Подмосковье – Получить подборку!";"От 1,6 млн ₽. Развитая инфраструктура. Свой лес. Рассрочка 0% Оцените выгоду сейчас!Проектная декларация на рекламируемом сайте";"https://полет.новостройки-москвы-и-московской-области.рус"
"";"";"";"Новостройка от застройщика – Квартиры от застройщика.";"Квартиры в корпусе «Дельта» со своим детским садом! Вид на Парк Дубки! 15 мин. метро!";"https://acentauri.ru"
"АО ""Сити-XXI век""";"+7 (495) 241-57-14";"post@city-xxi.ru";"Осень! Пора покупать квартиру! – Дома готовы!";"Забронируйте квартиру со скидкой до 25% в ЖК Краски Жизни уже сегодня! Торопитесь!";"https://kraski-zhizni-vidnoe.ru"
"АО ""Сити-XXI век""";"+7 (495) 241-57-14";"post@city-xxi.ru";"Составление сметы на ремонт / valinta.ru";"Актуальная база специалистов сметчиков. Только квалифицированные кадры!";"https://valinta.ru"
"АО ""Сити-XXI век""";"+7 (495) 241-57-14";"post@city-xxi.ru";"Осень! Пора покупать квартиру! – Дома готовы!";"Забронируйте квартиру со скидкой до 25% в ЖК Краски Жизни уже сегодня! Торопитесь!";"https://kraski-zhizni-vidnoe.ru"
"";"";"";"Новостройки от застройщика – Квартиры от 5,16 млн ₽";"Квартиры ЖК Успенский квартал в Одинцовском р-не. Готовые малоэтажные дома. Звоните!";"https://tkbbank.ru"
"OOO ""Кристалл""";"8 (800) 1000026";"manager@kristallyufo.ru";"Квартиры от застройщика – Анапа! / kristallyufo.ru";"Квартиры по 214-ФЗ без наценок напрямую от застройщика. Звоните бесплатно!";"https://kristallyufo.ru"
"ООО ""Кристалл""";"+7 (800) 100-00-26";"manager@anapameteora.ru";"Новостройки Московской области. – Спецпредложения!";"Актуальный каталог жилой недвижимости Москвы и Московской области.Проектная декларация на рекламируемом сайте";"https://msk.novostroy-gid.ru"
"ООО ""Кристалл""";"+7 (800) 100-00-26";"manager@anapameteora.ru";"Квартиры от застройщика – Анапа! / anapameteora.ru";"Квартиры по 214-ФЗ без наценок напрямую от застройщика. Звоните бесплатно!";"https://anapameteora.ru"
"";"";"";"Квартиры в Подмосковье от 1,2 млн – Золотое кольцо России";"Квартиры от 1,2 млн. руб. в туристическом центре. Скидки! Акции!Проектная декларация на рекламируемом сайте";"https://33novostroyki.ru"
"";"";"";"Частные объявления о сдаче квартир –";"Объявления о сдаче квартиры в ЖКПроектная декларация на рекламируемом сайте";"https://sland0.ru"
"";"";"";"Частные заказы на стройку и ремонт / poisk-pro.ru";"Свежие заказы на ремонт квартир и строительство. Без посредников. Ежедневно. 100 шт.";"https://poisk-pro.ru"
"";"";"";"Инициативным группам дольщиков! / nekrasoff.ru";"Правовой центр Олега Некрасова: реальная помощь пострадавшим дольщикам";"https://nekrasoff.ru"
"";"";"";"ЖК ""Южное Бунино"". Новая Москва / vk.com";"Индивидуальные планировки, квартиры с патио, окружение лесопарками,недалеко от метро";"https://vk.com"
"";"";"";"Новостройки Подмосковья от застройщиков на карте";"Все новостройки Москвы – планировки и цены на квартиры от застройщика!Проектная декларация на рекламируемом сайте";"https://msk-novostroyki.ru"
"";"";"";"Недорогая квартира в Рязани / rielt62.ru";"новостройка от 1 047 000 рублей от застройщикаПроектная декларация на рекламируемом сайте";"https://rielt62.ru"
"";"";"";"Купить новостройку в Подмосковье – ЖК ""Нахабино Ясное""";"С отделкой от 3,2 млн. Ипотечные каникулы, первый взнос 0%. Детский сад, школа. Звоните!";"https://yanahabino.ru"
"Отдел продаж";"+7 (988) 234-34-89";"family.23@list.ru";"Центр мебельных комплектующих TDM / tdmspb.ru";"Качественная продукция. Оплата при получении. Доставка по РФ";"https://tdmspb.ru"
"Отдел продаж";"+7 (988) 234-34-89";"family.23@list.ru";"Квартиры в ЖК Семейный Сочи / сочи-жк-семейный.рф";"Стоимость 1м2 от 64 000 руб. Площадь квартир от 22м2 до 57м2.";"https://сочи-жк-семейный.рф"
"";"";"";"Новостройки Подмосковья / poisk-novostroyki.ru";"Каталог и карта новостроек Подмосковья. Продажа и скидки от застройщиков.Проектная декларация на рекламируемом сайте";"https://poisk-novostroyki.ru"
"";"";"";"Как переехать в Московскую область? / kp-podol.ru";"Земельные участки с подрядом на строительство дома! Живописный район Подмосковья!";"https://kp-podol.ru"
