"firm";"phone";"email";"title";"text";"domain"
"";"";"";"Купить жилье под маткапитал / center-fp.ru";"Поможем официально купить жилье под материнский капитал у родственников и др. лиц!";"https://center-fp.ru"
"";"";"";"ЖК ""Государев Дом"" – квартиры от 1,6 млн р.";"ЖК ""Государев Дом"", квартиры от 1,6 млн р. в 5 км. от МКАД.";"https://gosudarev-dom.pro"
"";"";"";"Эко-отель ""Барвиха""  – Выгодные цены";"Путевки в эко-отель ""Барвиха"" Алтай От КУРОРТНОГО МАГАЗИНА";"https://kurortmag.ru"
"";"";"";"Купить жилье под маткапитал / center-fp.ru";"Поможем официально купить жилье под материнский капитал у родственников и др. лиц!";"https://center-fp.ru"
"";"";"";"ЖК ""Государев Дом"" – квартиры от 1,6 млн р.";"ЖК ""Государев Дом"", квартиры от 1,6 млн р. в 5 км. от МКАД.";"https://gosudarev-dom.pro"
"";"";"";"Юридическая консультация в Москве / pravozona.ru";"Готовы помочь Вам решить Ваши проблемы. Консультация бесплатно. Звоните или пишите";"https://pravozona.ru"
"";"";"";"Студии, квартиры в Севастополе / crymchanka.ru";"Без агентской комиссии, процентов, переплат. С балконом и видом на море!Проектная декларация на рекламируемом сайте";"https://crymchanka.ru"
"";"";"";"Предложения недвижимости в Сочи / novostroika-sochi.com";"Квартиры в новостройках Сочи недорого.Только проверенные застройщики";"https://novostroika-sochi.com"
"";"";"";"Новостройки - Не знаете последние новости о новостройках?";"Яркие факты!Проектная декларация на рекламируемом сайте";"https://mybbs.ru"
"";"";"";"Квазар – бесплатные объявления / kvazar.top";"Бесплатные объявления вашего города частных лиц и компаний разной тематики.";"https://kvazar.top"
"";"";"";"Недвижимость в Балашихе / balashikha.domex.ru";"Недвижимость из рук в руки в г. Балашиха. Квартиры. Дома. Офисы. Участки!Проектная декларация на рекламируемом сайте";"https://balashikha.domex.ru"
"";"";"";"Ремонт потолка фото - Дизайн потолков.";"Фотографии и примеры ремонта и оформления потолков.";"https://photocatalog.online"
"Квартирник78";"+7 (812) 785-08-36";"iulya.super2018@yandex.ru";"ООО НВ-Комплекс - Строительная компания.";"Отделка и ремонт квартир под ключ";"https://remontmoskve.ru"
"Квартирник78";"+7 (812) 785-08-36";"iulya.super2018@yandex.ru";"Строительный портал / linkstroy.ru";"Строительные компании и фирмы, новости, обзоры и статьи, доска объявлений.";"https://linkstroy.ru"
"Квартирник78";"+7 (812) 785-08-36";"iulya.super2018@yandex.ru";"ремонт квартиры / stroimdom.su";"обучающее наглядное пособие о ремонте квартиры";"https://stroimdom.su"
"Квартирник78";"+7 (812) 785-08-36";"iulya.super2018@yandex.ru";"Строительство и ремонт от А до Я. / дженерал-строй.москва";"Компания выполнит работы в указанные сроки и по договорной цене.";"https://дженерал-строй.москва"
"Квартирник78";"+7 (812) 785-08-36";"iulya.super2018@yandex.ru";"Помощь – научные и учебные работы";"Помощь с выполнением научных и учебных работ. Коллектив специалистов.";"https://научныеиучебныеработы.дм-консалтинг..."
"Квартирник78";"+7 (812) 785-08-36";"iulya.super2018@yandex.ru";"Поставки уличной мебели / 5805845.ru";"26 дистрибьюторских центров в России и СНГ. Огромный ассортимент.";"https://5805845.ru"
"Квартирник78";"+7 (812) 785-08-36";"iulya.super2018@yandex.ru";"Современные картины / posternazakaz.ru";"Современные картины для интерьера. Доставка в любой город. Скидки.";"https://posternazakaz.ru"
"Квартирник78";"+7 (812) 785-08-36";"iulya.super2018@yandex.ru";"Устали искать какую квартиру купить / kvartirnik78.ru";"Устали искать какую квартиру купить в Санкт-Петербурге?Идеальный вариант за 20 м";"https://kvartirnik78.ru"
"";"";"";"застройщики.рф - домен продается / застройщики.рф";"застройщики.рф - купить или арендовать доменное имя на SITE.SU";"https://застройщики.рф"
"";"";"";"Наружная отделка зданий. / viross.ru";"Красивая и функциональная наружная отделка недвижимости от подрядчика.";"https://viross.ru"
"ЖК ""Гусарская баллада""";"+7 (495) 409-74-25";"info@gusballodin.ru";"новостройку.рф - домен продается / новостройку.рф";"новостройку.рф - купить или арендовать доменное имя на SITE.SUПроектная декларация на рекламируемом сайте";"https://новостройку.рф"
"ЖК ""Гусарская баллада""";"+7 (495) 409-74-25";"info@gusballodin.ru";"отделки.рф - домен продается / отделки.рф";"отделки.рф - купить или арендовать доменное имя на SITE.SU";"https://отделки.рф"
"ЖК ""Гусарская баллада""";"+7 (495) 409-74-25";"info@gusballodin.ru";"Услуги проектирования на заказ";"Профессионально услуги проектирования на заказ. Коллектив специалистов.";"https://проектирование.дм-консалтинг.рф"
"ЖК ""Гусарская баллада""";"+7 (495) 409-74-25";"info@gusballodin.ru";"Квартиры в ЖК «Гусарская баллада» / gusballodin.ru";"Квартиры по низким ценам в новом доме. Г. Одинцово, ЖК «Гусарская баллада», 24 Корпус";"https://gusballodin.ru"
"";"";"";"Ремонт квартир в Москве и МО / remont-divo.ru";"Ремонт квартир, офисов под ключ в Москве и МО, качество, гарантия.";"https://remont-divo.ru"
"";"";"";"Ремонт в рассрочку и кредит! - Ремонт сейчас, деньги потом!";"От 0%годовых. Предоставляется банком партнеромСодействие в подборе финансовых услуг/организа…Содействие в подборе финансовых услуг/организаций";"https://or-stroy.ru"
"";"";"";"Опасная недвижимость в Крыму / kvartira-v-krimy.ru";"Отзывы и обсуждения недвижимости в Крыму. Советы при выборе недвижимости.Проектная декларация на рекламируемом сайте";"https://kvartira-v-krimy.ru"
"";"";"";"Московская газета объявлений";"Интернет-газета объявлений г.Москва.";"https://москва-объявления-реклама.рф"
"";"";"";"Ваш личный риэлтор";"Сдам Вашу квартиру - быстро и дорого. Услуги для собственников бесплатные.";""
"";"";"";"Копка колодцев. 4 000 Руб/Кольцо / vykopatkolodec.ru";"Копаем вручную круглый год. На все выкопанные нами колодцы мы даем гарантию";"https://vykopatkolodec.ru"
"";"";"";"Колодцы пластиковые 300 - 600 мм - Высотой 1м, 1.5м, 2м.....";"6м у нас на складе. Низкие цены. Все для дренажа!";"https://все-для-дренажа.рф"
"";"";"";"Требуются земляные работы – Вакансии. Земляные работы";"500 заказов в день. Без посредников. Зарабатывайте на Ремонтник.ру!";"https://remontnik.ru"
"";"";"";"Чистка и ремонт колодцев / kolodeznik.ru";"Квалифицированные гидрогеологи. Работаем с 1996 года. Москва и Подмосковье.";"https://kolodeznik.ru"
"";"";"";"Колодцы ЖБИ – типы, конструкци - В полном ассортименте.";"Пришлите заявку нам, мы привезем дешевле чем другие.";"https://gbi4.ru"
"";"";"";"Колодцы в Подмосковье – Копка колодца на воду под ключ";"Выкопаем колодец на даче недорого. Колодцы в Подмосковье под ключ. Цены на колодцы.";"https://aquacop.ru"
"";"";"";"Живете в частной доме? – Усиление сигнала связи";"Оборудование для максимального приема сотовой связи и интернета 3G/4G";"https://gsm-repiteri.ru"
"";"";"";"Колодец под ключ / kopaem-burim.ru";"Колодец под ключ - цена копки тут. Колодец на воду под ключ, цена тут.";"https://kopaem-burim.ru"
"";"";"";"«Эспогерм» - герметик для швов / krasko.ru";"Фасадный полиуретановый герметик. Герметизация межпанельных швов и стыков.";"https://krasko.ru"
"";"";"";"Гостиный двор ""Горки"" Алтай – Выгодные цены";"Путевки в гостиный двор ""Горки"" Алтай от КУРОРТНОГО МАГАЗИНА";"https://kurortmag.ru"
"Посад-Строй";"+7 (916) 977-57-97";"5108159@mail.ru";"Эко-отель ""Барвиха""  – Выгодные цены";"Путевки в эко-отель ""Барвиха"" Алтай От КУРОРТНОГО МАГАЗИНА";"https://kurortmag.ru"
"Посад-Строй";"+7 (916) 977-57-97";"5108159@mail.ru";"Колодец / landclub.net";"Узнайте предложения организаций и предпринимателей.";"https://landclub.net"
"Посад-Строй";"+7 (916) 977-57-97";"5108159@mail.ru";"Колодец на даче / linkstroy.ru";"Как обустроить колодец на даче – советы профессионалов на портале LinkStroy";"https://linkstroy.ru"
"Посад-Строй";"+7 (916) 977-57-97";"5108159@mail.ru";"Квартиры в Московской области! / domex.ru";"Недвижимость в Московской области. Широчайший выбор по доступным ценам!Проектная декларация на рекламируемом сайте";"https://domex.ru"
"Посад-Строй";"+7 (916) 977-57-97";"5108159@mail.ru";"Строительство, фундаменты. / posad-stroy.tiu.ru";"Малоэтажное строительство и благоустройство от котлована под ключ. АРБОЛИТ";"https://posad-stroy.tiu.ru"
"";"";"";"К чему снится колодец? / my-dreams.info";"Узнай, к чему снится колодец. Современный сонник. Читай на сайте:";"https://my-dreams.info"
